Codigo;Producto;Modelo;Opcion;PreMay;Urlimagen;Sale;Nuevo;Time;Info;Estado;
PR0001;Conjunto Friza Ardilla Azul;Conjunto Friza Prematuro Ardilla;NB,PR;8900;https://res.cloudinary.com/dkfsnrkcy/image/upload/v1741625882/f9svknayvqtfo5otgbsk.jpg;si;si;9/06/2025;Conjunto 3 piezas \n Interlock estampado \n de recien nacido hasta 12 Meses;;
PR0002;Conjunto Friza Ardilla Celeste;Conjunto Friza Prematuro Ardilla;NB,PR;8900;https://res.cloudinary.com/dkfsnrkcy/image/upload/v1741625896/fqxvfvd9v6s49pos6hpu.jpg;no;no;8/06/2025;;;
PR0003;Conjunto Friza Ardilla Gris;Conjunto Friza Prematuro Ardilla;NB,PR;8900;https://res.cloudinary.com/dkfsnrkcy/image/upload/v1741625908/xi41f7bxw3qjmvfaz0wz.jpg;no;no;;;;
PR0004;CONJUNTO PRUEBA ONE;CONJUNTO PRUEBA;3M,6M,9M;999999;https://res.cloudinary.com/dkfsnrkcy/image/upload/v1750898154/xrw1ecg6ezlnb1piy7ib.jpg;no;si;25/06/2025;;public;
PR0005;CONJUNTO PRUEBA TWO;CONJUNTO PRUEBA;3M,6M,9M;11111;https://res.cloudinary.com/dkfsnrkcy/image/upload/v1750899079/na4djsmoksemqt5gmlfd.jpg;no;si;25/06/2025;;public;